{
  "pluginId": "vision-7-with-spur",
  "displayName": "Bovilis Vision 7 with Spur (clostridial bacterin-toxoid)",
  "version": "1.0.0",
  "type": "animal-health",
  "productKind": "vaccine",
  "activeIngredients": [
    {
      "name": "Clostridium chauvoei-septicum-novyi-sordellii-perfringens Types C & D bacterin-toxoid"
    }
  ],
  "marketingStatus": "otc",
  "labelUses": [
    {
      "speciesId": "cattle",
      "class": "all",
      "routes": [
        "injection-sc"
      ],
      "withdrawal": {
        "meatDays": 21
      }
    },
    {
      "speciesId": "sheep",
      "class": "all",
      "routes": [
        "injection-sc"
      ],
      "withdrawal": {
        "meatDays": 21
      }
    }
  ],
  "notes": "Clostridial 7-way vaccine for healthy cattle and sheep. The label states one slaughter restriction and no milk or egg restriction, so none is recorded and milk stays unknown."
}
